{
  "schema_version": "fabricctl.bundle-manifest/v1",
  "self_exclusion": "bundle-manifest.json",
  "files": [
    {"path": "fabric-values.yaml", "sha256": "1111111111111111111111111111111111111111111111111111111111111111"},
    {"path": "install-target.yaml", "sha256": "2222222222222222222222222222222222222222222222222222222222222222"},
    {"path": "installation-plan.json", "sha256": "3333333333333333333333333333333333333333333333333333333333333333"},
    {"path": "secrets-required.yaml", "sha256": "4444444444444444444444444444444444444444444444444444444444444444"},
    {"path": "singleaxis.yaml", "sha256": "5555555555555555555555555555555555555555555555555555555555555555"}
  ],
  "bundle_digest": "sha256:c8b37d32c8bcd3fc521f31d376d0ee7f0982a48bb5e1073ed92703bc4b67cb07",
  "generator": {
    "name": "fabricctl",
    "version": "1.0.0",
    "commit": "0123456789abcdef0123456789abcdef01234567"
  }
}
